,title,query
215,"Điều 290: Quyết định đưa vụ án ra xét xử phúc thẩm Quyết định đưa vụ án ra xét xử phúc thẩm phải có các nội dung chính sau đây Các nội dung quy định tại các điểm a, b, c, d, g, h và i khoản 1 Điều 220 của Bộ luật này Họ, tên Thẩm phán, Thư ký Tòa án họ, tên Thẩm phán dự khuyết (nếu có) Họ, tên, tư cách tham gia tố tụng của người kháng cáo Viện kiểm sát kháng nghị (nếu có) Họ, tên Kiểm sát viên tham gia phiên tòa họ, tên Kiểm sát viên dự khuyết (nếu có): Quyết định đưa vụ án ra xét xử phúc thẩm phải được gửi cho đương sự, Viện kiểm sát cùng cấp trong thời hạn 03 ngày làm việc, kể từ ngày ra quyết định",Điều gì xảy ra nếu quyết định đưa vụ án ra xét xử phúc thẩm không được gửi đúng trong thời hạn 03 ngày làm việc?
167,"Điều 246: Công nhận sự thoả thuận của các đương sự Chủ tọa phiên tòa hỏi các đương sự có thoả thuận được với nhau về việc giải quyết vụ án hay không trường hợp các đương sự thoả thuận được với nhau về việc giải quyết vụ án và thoả thuận của họ là tự nguyện, không vi phạm điều cấm của luật và không trái đạo đức xã hội thì Hội đồng xét xử ra quyết định công nhận sự thoả thuận của các đương sự về việc giải quyết vụ án: Quyết định công nhận sự thoả thuận của các đương sự về việc giải quyết vụ án có hiệu lực pháp luật theo quy định tại Điều 213 của Bộ luật này","Nếu một đương sự không xuất hiện tại phiên tòa sau khi thoả thuận, liệu Hội đồng xét xử có quyền yêu cầu sự hiện diện của họ không?"
52,"Điều 222: Yêu cầu chung đối với phiên tòa sơ thẩm Phiên tòa sơ thẩm phải được tiến hành đúng thời gian, địa điểm đã được ghi trong quyết định đưa vụ án ra xét xử hoặc trong giấy báo mở lại phiên tòa trong trường hợp phải hoãn phiên tòa",Điều 222 có quy định cụ thể về thời gian tối đa mà một phiên tòa sơ thẩm có thể kéo dài không?
432,"Điều 110: Bảo vệ chứng cứ Trường hợp chứng cứ đang bị tiêu huỷ, có nguy cơ bị tiêu hủy hoặc sau này khó có thể thu thập được thì đương sự có quyền đề nghị Tòa án quyết định áp dụng biện pháp cần thiết để bảo toàn chứng cứ: Đề nghị của đương sự phải thể hiện bằng văn bản: Tòa án có thể quyết định áp dụng một hoặc một số trong các biện pháp niêm phong, thu giữ, chụp ảnh, ghi âm, ghi hình, phục chế, khám nghiệm, lập biên bản và các biện pháp khác: Trường hợp người làm chứng bị lừa dối, đe dọa, cưỡng ép hoặc mua chuộc để không cung cấp chứng cứ hoặc cung cấp chứng cứ sai sự thật thì Tòa án có quyền quyết định buộc người có hành vi lừa dối, đe dọa, cưỡng ép hoặc mua chuộc phải chấm dứt hành vi đó: Trường hợp hành vi đó có dấu hiệu tội phạm thì Tòa án yêu cầu Viện kiểm sát xem xét về trách nhiệm hình sự",Có những biện pháp bảo toàn chứng cứ nào mà Tòa án có thể áp dụng theo Điều 110?
406,"Điều 224: Hình thức bố trí phòng xử án Quốc huy nước Cộng hòa xã hội chủ nghĩa Việt Nam được treo chính giữa phía trên phòng xử án và phía trên chỗ ngồi của Hội đồng xét xử: Phòng xử án phải có các khu vực được bố trí riêng cho Hội đồng xét xử, Kiểm sát viên, Thư ký Tòa án, đương sự, người bảo vệ quyền và lợi ích hợp pháp của đương sự, những người tham gia tố tụng khác và người tham dự phiên tòa",Quy định về hình thức bố trí phòng xử án được thực hiện như thế nào trong các phiên tòa?
37,"Điều 411: Trình tự phiên họp xét tính hợp pháp của cuộc đình công Thẩm phán chủ trì phiên họp xét tính hợp pháp của cuộc đình công công bố quyết định mở phiên họp xét tính hợp pháp của cuộc đình công và tóm tắt nội dung đơn yêu cầu: Đại diện tổ chức đại diện tập thể lao động và đại diện của người sử dụng lao động trình bày ý kiến của mình: Thẩm phán chủ trì phiên họp xét tính hợp pháp của cuộc đình công có thể yêu cầu đại diện cơ quan, tổ chức tham gia phiên họp trình bày ý kiến: Kiểm sát viên phát biểu ý kiến của Viện kiểm sát về việc xét tính hợp pháp của cuộc đình công: Ngay sau khi kết thúc phiên họp, Kiểm sát viên phải gửi văn bản phát biểu ý kiến cho Tòa án để lưu vào hồ sơ việc dân sự: Hội đồng xét tính hợp pháp của cuộc đình công thảo luận và quyết định theo đa số",Điều 411 có quy định cụ thể về việc lưu trữ hồ sơ việc dân sự sau phiên họp xét tính hợp pháp không?
129,"Điều 490: Xử lý hành vi cố ý không có mặt theo giấy triệu tập của Tòa án Người làm chứng, người phiên dịch, người giám định đã được Tòa án triệu tập hợp lệ nhưng cố ý không đến Tòa án hoặc không có mặt tại phiên tòa, phiên họp mà không có lý do chính đáng và nếu sự vắng mặt của họ gây trở ngại cho việc thu thập, xác minh chứng cứ hoặc giải quyết vụ việc thì bị xử phạt hành chính theo quy định của pháp luật: Trong trường hợp quy định tại khoản 1 Điều này, Tòa án có quyền ra quyết định dẫn giải người làm chứng đến phiên tòa, phiên họp, trừ trường hợp người làm chứng là người chưa thành niên: Quyết định dẫn giải người làm chứng phải ghi rõ thời gian, địa điểm ra quyết định họ, tên, chức vụ người ra quyết định họ, tên, ngày, tháng, năm sinh, nơi cư trú của người làm chứng thời gian, địa điểm người làm chứng phải có mặt: Cơ quan công an có nhiệm vụ thi hành quyết định của Tòa án dẫn giải người làm chứng: Người thi hành quyết định dẫn giải người làm chứng phải đọc, giải thích quyết định dẫn giải cho người bị dẫn giải biết và lập biên bản về việc dẫn giải","Khi người làm chứng phải có mặt theo quyết định dẫn giải, liệu có biện pháp bảo vệ nào đảm bảo an toàn và quyền lợi cho họ trong quá trình này?"
179,"Điều 429: Bảo đảm quyền chuyển tiền, tài sản thi hành bản án, quyết định dân sự của Tòa án nước ngoài, phán quyết của Trọng tài nước ngoài Nhà nước Việt Nam bảo đảm việc chuyển tiền, tài sản thi hành bản án, quyết định dân sự của Tòa án nước ngoài, phán quyết của Trọng tài nước ngoài đã được Tòa án Việt Nam công nhận và cho thi hành từ Việt Nam ra nước ngoài: Việc chuyển tiền, tài sản này được thực hiện theo quy định của pháp luật Việt Nam","Trong quá trình thi hành, nếu phát sinh tranh chấp mới, liệu có quy định nào về việc đình chỉ hay điều chỉnh quá trình chuyển tiền, tài sản không?"
444,"Điều 190: Gửi đơn khởi kiện đến Tòa án Người khởi kiện gửi đơn khởi kiện kèm theo tài liệu, chứng cứ mà mình hiện có đến Tòa án có thẩm quyền giải quyết vụ án bằng các phương thức sau đây Nộp trực tiếp tại Tòa án Gửi đến Tòa án theo đường dịch vụ bưu chính Gửi trực tuyến bằng hình thức điện tử qua Cổng thông tin điện tử của Tòa án (nếu có): Ngày khởi kiện là ngày đương sự nộp đơn khởi kiện tại Tòa án hoặc ngày được ghi trên dấu của tổ chức dịch vụ bưu chính nơi gửi: Trường hợp không xác định được ngày, tháng, năm theo dấu bưu chính nơi gửi thì ngày khởi kiện là ngày đương sự gửi đơn tại tổ chức dịch vụ bưu chính: Đương sự phải chứng minh ngày mình gửi đơn tại tổ chức dịch vụ bưu chính trường hợp đương sự không chứng minh được thì ngày khởi kiện là ngày Tòa án nhận được đơn khởi kiện do tổ chức dịch vụ bưu chính chuyển đến: Trường hợp người khởi kiện gửi đơn khởi kiện bằng phương thức gửi trực tuyến thì ngày khởi kiện là ngày gửi đơn: Trường hợp chuyển vụ án cho Tòa án khác theo quy định tại Điều 41 của Bộ luật này thì ngày khởi kiện là ngày gửi đơn khởi kiện đến Tòa án đã thụ lý nhưng không đúng thẩm quyền và được xác định theo quy định tại khoản 2 và khoản 3 Điều này: Tòa án nhân dân tối cao hướng dẫn thi hành Điều này",Ngày khởi kiện là gì khi người khởi kiện gửi đơn khởi kiện bằng hình thức điện tử qua Cổng thông tin điện tử của Tòa án?
321,"Điều 355: Thời hạn kháng nghị theo thủ tục tái thẩm Thời hạn kháng nghị theo thủ tục tái thẩm là 01 năm, kể từ ngày người có thẩm quyền kháng nghị biết được căn cứ để kháng nghị theo thủ tục tái thẩm quy định tại Điều 352 của Bộ luật này",Thời hạn một năm cho kháng nghị theo thủ tục tái thẩm có áp dụng cho tất cả các loại vụ án không? Có những trường hợp ngoại lệ nào có thể kéo dài thời hạn này?
72,"Điều 156: Nghĩa vụ nộp tiền tạm ứng chi phí xem xét, thẩm định tại chỗ Người yêu cầu Tòa án xem xét, thẩm định tại chỗ phải nộp tiền tạm ứng chi phí xem xét, thẩm định tại chỗ theo yêu cầu của Tòa án: Trường hợp Tòa án xét thấy cần thiết và quyết định xem xét, thẩm định tại chỗ thì nguyên đơn, người yêu cầu giải quyết việc dân sự, người kháng cáo theo thủ tục phúc thẩm phải nộp tiền tạm ứng chi phí xem xét, thẩm định tại chỗ","Thủ tục và quy trình cụ thể mà người yêu cầu phải tuân thủ khi nộp tiền tạm ứng chi phí xem xét, thẩm định tại chỗ theo quy định của điều 156 là gì?"
2,"Điều 375: Thủ tục tiến hành phiên họp phúc thẩm giải quyết việc dân sự Phiên họp phúc thẩm giải quyết việc dân sự được tiến hành theo trình tự sau đây Thư ký phiên họp báo cáo về sự có mặt, vắng mặt của những người tham gia phiên họp Thẩm phán chủ tọa phiên họp khai mạc phiên họp, kiểm tra về sự có mặt, vắng mặt của những người được triệu tập tham gia phiên họp và căn cước của họ, giải thích quyền và nghĩa vụ của người tham gia phiên họp Người bảo vệ quyền và lợi ích hợp pháp của người kháng cáo, người kháng cáo hoặc người đại diện hợp pháp của họ trình bày về nội dung kháng cáo và căn cứ của việc kháng cáo Trường hợp chỉ có Viện kiểm sát kháng nghị thì Kiểm sát viên trình bày về nội dung kháng nghị và căn cứ của việc kháng nghị: Trường hợp vừa có kháng cáo, vừa có kháng nghị thì các đương sự trình bày về nội dung kháng cáo và các căn cứ của việc kháng cáo trước, sau đó Kiểm sát viên trình bày về nội dung kháng nghị và căn cứ của việc kháng nghị: Trường hợp Viện kiểm sát không kháng nghị thì Kiểm sát viên phát biểu ý kiến của Viện kiểm sát về việc giải quyết kháng cáo trước khi Hội đồng phúc thẩm ra quyết định: Ngay sau khi kết thúc phiên họp, Kiểm sát viên phải gửi văn bản phát biểu ý kiến cho Tòa án để lưu vào hồ sơ việc dân sự Người bảo vệ quyền và lợi ích hợp pháp của người có quyền lợi, nghĩa vụ liên quan, người có quyền lợi, nghĩa vụ liên quan hoặc người đại diện hợp pháp của họ trình bày ý kiến về những vấn đề có liên quan đến quyền, nghĩa vụ của người có quyền lợi, nghĩa vụ liên quan trong nội dung kháng cáo, kháng nghị Người làm chứng trình bày ý kiến người giám định trình bày kết luận giám định, giải thích những vấn đề còn chưa rõ hoặc có mâu thuẫn: Trường hợp có người được Tòa án triệu tập tham gia phiên họp vắng mặt thì Thẩm phán cho công bố lời khai, tài liệu, chứng cứ do người đó cung cấp: Hội đồng phúc thẩm xem xét quyết định của Tòa án cấp sơ thẩm bị kháng cáo, kháng nghị, tài liệu, chứng cứ có liên quan và ra một trong các quyết định sau đây Giữ nguyên quyết định giải quyết việc dân sự của Tòa án cấp sơ thẩm Sửa quyết định giải quyết việc dân sự của Tòa án cấp sơ thẩm Hủy quyết định giải quyết việc dân sự của Tòa án cấp sơ thẩm và chuyển hồ sơ việc dân sự cho Tòa án cấp sơ thẩm để giải quyết lại theo thủ tục sơ thẩm Hủy quyết định giải quyết việc dân sự của Tòa án cấp sơ thẩm và đình chỉ giải quyết việc dân sự Đình chỉ giải quyết việc xét đơn yêu cầu theo thủ tục phúc thẩm nếu tại phiên họp tất cả người kháng cáo rút đơn kháng cáo, Viện kiểm sát rút kháng nghị: Quyết định phúc thẩm giải quyết việc dân sự có hiệu lực pháp luật kể từ ngày ra quyết định và được gửi cho cơ quan, tổ chức, cá nhân quy định tại khoản 2 và khoản 3 Điều 370 của Bộ luật này: Quyết định phúc thẩm giải quyết việc dân sự có hiệu lực pháp luật được công bố trên Cổng thông tin điện tử của Tòa án (nếu có), trừ quyết định có chứa thông tin quy định tại khoản 2 Điều 109 của Bộ luật này","Khi chỉ có viện kiểm sát kháng nghị, thì kiểm sát viên phải làm gì trong phiên họp phúc thẩm?"
404,"Điều 224: Hình thức bố trí phòng xử án Quốc huy nước Cộng hòa xã hội chủ nghĩa Việt Nam được treo chính giữa phía trên phòng xử án và phía trên chỗ ngồi của Hội đồng xét xử: Phòng xử án phải có các khu vực được bố trí riêng cho Hội đồng xét xử, Kiểm sát viên, Thư ký Tòa án, đương sự, người bảo vệ quyền và lợi ích hợp pháp của đương sự, những người tham gia tố tụng khác và người tham dự phiên tòa",Tại sao việc bố trí phòng xử án và các khu vực riêng biệt trong phiên tòa quan trọng?
250,"Điều 266: Bản án sơ thẩm Tòa án ra bản án nhân danh nước Cộng hòa xã hội chủ nghĩa Việt Nam: Bản án gồm có phần mở đầu, phần nội dung vụ án và nhận định và phần quyết định của Tòa án, cụ thể như sau Trong phần mở đầu phải ghi rõ tên Tòa án xét xử sơ thẩm số và ngày thụ lý vụ án số bản án và ngày tuyên án họ, tên của các thành viên Hội đồng xét xử, Thư ký phiên tòa, Kiểm sát viên, người giám định, người phiên dịch tên, địa chỉ của nguyên đơn, bị đơn, người có quyền lợi, nghĩa vụ liên quan, cơ quan, tổ chức, cá nhân khởi kiện người đại diện hợp pháp, người bảo vệ quyền và lợi ích hợp pháp của đương sự đối tượng tranh chấp số, ngày, tháng, năm của quyết định đưa vụ án ra xét xử xét xử công khai hoặc xét xử kín thời gian và địa điểm xét xử Trong phần nội dung vụ án và nhận định của Tòa án phải ghi yêu cầu khởi kiện của nguyên đơn, yêu cầu khởi kiện của cơ quan, tổ chức, cá nhân yêu cầu phản tố, đề nghị của bị đơn yêu cầu độc lập, đề nghị của người có quyền lợi, nghĩa vụ liên quan: Tòa án phải căn cứ vào tài liệu, chứng cứ đã được xem xét tại phiên tòa, kết quả tranh tụng tại phiên tòa để phân tích, đánh giá, nhận định đầy đủ, khách quan về các tình tiết của vụ án, những căn cứ pháp luật, nếu vụ án thuộc trường hợp quy định tại khoản 2 Điều 4 của Bộ luật này thì còn phải căn cứ vào tập quán, tương tự pháp luật, những nguyên tắc cơ bản của pháp luật dân sự, án lệ hoặc lẽ công bằng, để chấp nhận hoặc không chấp nhận yêu cầu, đề nghị của đương sự, người bảo vệ quyền và lợi ích hợp pháp của đương sự và giải quyết các vấn đề khác có liên quan Trong phần quyết định phải ghi rõ các căn cứ pháp luật, quyết định của Hội đồng xét xử về từng vấn đề phải giải quyết trong vụ án, về áp dụng biện pháp khẩn cấp tạm thời, án phí, chi phí tố tụng và quyền kháng cáo đối với bản án trường hợp có quyết định phải thi hành ngay thì phải ghi rõ quyết định đó: Khi xét xử lại vụ án mà bản án, quyết định đã bị hủy một phần hoặc toàn bộ theo quyết định giám đốc thẩm, tái thẩm thì Tòa án phải giải quyết vấn đề tài sản, nghĩa vụ đã được thi hành (nếu có) theo bản án, quyết định có hiệu lực pháp luật nhưng bị hủy và ghi rõ trong bản án","Trong bản án sơ thẩm theo Điều 266, phần mở đầu cần ghi rõ thông tin gì về phiên tòa và các bên tham gia vụ án?"
42,"Điều 6: Cung cấp chứng cứ và chứng minh trong tố tụng dân sự Đương sự có quyền và nghĩa vụ chủ động thu thập, giao nộp chứng cứ cho Tòa án và chứng minh cho yêu cầu của mình là có căn cứ và hợp pháp: Cơ quan, tổ chức, cá nhân khởi kiện, yêu cầu để bảo vệ quyền và lợi ích hợp pháp của người khác có quyền và nghĩa vụ thu thập, cung cấp chứng cứ, chứng minh như đương sự: Tòa án có trách nhiệm hỗ trợ đương sự trong việc thu thập chứng cứ và chỉ tiến hành thu thập, xác minh chứng cứ trong những trường hợp do Bộ luật này quy định",Điều 6 có quy định gì về việc bảo vệ quyền và lợi ích hợp pháp của người khác qua việc thu thập chứng cứ?
254,"Điều 266: Bản án sơ thẩm Tòa án ra bản án nhân danh nước Cộng hòa xã hội chủ nghĩa Việt Nam: Bản án gồm có phần mở đầu, phần nội dung vụ án và nhận định và phần quyết định của Tòa án, cụ thể như sau Trong phần mở đầu phải ghi rõ tên Tòa án xét xử sơ thẩm số và ngày thụ lý vụ án số bản án và ngày tuyên án họ, tên của các thành viên Hội đồng xét xử, Thư ký phiên tòa, Kiểm sát viên, người giám định, người phiên dịch tên, địa chỉ của nguyên đơn, bị đơn, người có quyền lợi, nghĩa vụ liên quan, cơ quan, tổ chức, cá nhân khởi kiện người đại diện hợp pháp, người bảo vệ quyền và lợi ích hợp pháp của đương sự đối tượng tranh chấp số, ngày, tháng, năm của quyết định đưa vụ án ra xét xử xét xử công khai hoặc xét xử kín thời gian và địa điểm xét xử Trong phần nội dung vụ án và nhận định của Tòa án phải ghi yêu cầu khởi kiện của nguyên đơn, yêu cầu khởi kiện của cơ quan, tổ chức, cá nhân yêu cầu phản tố, đề nghị của bị đơn yêu cầu độc lập, đề nghị của người có quyền lợi, nghĩa vụ liên quan: Tòa án phải căn cứ vào tài liệu, chứng cứ đã được xem xét tại phiên tòa, kết quả tranh tụng tại phiên tòa để phân tích, đánh giá, nhận định đầy đủ, khách quan về các tình tiết của vụ án, những căn cứ pháp luật, nếu vụ án thuộc trường hợp quy định tại khoản 2 Điều 4 của Bộ luật này thì còn phải căn cứ vào tập quán, tương tự pháp luật, những nguyên tắc cơ bản của pháp luật dân sự, án lệ hoặc lẽ công bằng, để chấp nhận hoặc không chấp nhận yêu cầu, đề nghị của đương sự, người bảo vệ quyền và lợi ích hợp pháp của đương sự và giải quyết các vấn đề khác có liên quan Trong phần quyết định phải ghi rõ các căn cứ pháp luật, quyết định của Hội đồng xét xử về từng vấn đề phải giải quyết trong vụ án, về áp dụng biện pháp khẩn cấp tạm thời, án phí, chi phí tố tụng và quyền kháng cáo đối với bản án trường hợp có quyết định phải thi hành ngay thì phải ghi rõ quyết định đó: Khi xét xử lại vụ án mà bản án, quyết định đã bị hủy một phần hoặc toàn bộ theo quyết định giám đốc thẩm, tái thẩm thì Tòa án phải giải quyết vấn đề tài sản, nghĩa vụ đã được thi hành (nếu có) theo bản án, quyết định có hiệu lực pháp luật nhưng bị hủy và ghi rõ trong bản án",Bản án sơ thẩm theo Điều 266 phải ghi rõ quyền kháng cáo của bên thua. Quyền kháng cáo này được thực hiện như thế nào?
315,"Điều 127: Cấm hoặc buộc thực hiện hành vi nhất định Cấm hoặc buộc thực hiện hành vi nhất định được áp dụng nếu trong quá trình giải quyết vụ án có căn cứ cho thấy đương sự hoặc cơ quan, tổ chức, cá nhân khác thực hiện hoặc không thực hiện một hoặc một số hành vi nhất định làm ảnh hưởng đến việc giải quyết vụ án, quyền và lợi ích hợp pháp của người khác có liên quan trong vụ án đang được Tòa án giải quyết","Trong việc thực hiện Điều 127, có sự cân nhắc về tính tỷ lệ và sự cần thiết của các hành vi bị cấm hoặc buộc thực hiện không?"
458,"Điều 143: Tiền tạm ứng án phí, tiền tạm ứng lệ phí án phí, lệ phí Tiền tạm ứng án phí bao gồm tiền tạm ứng án phí sơ thẩm và tiền tạm ứng án phí phúc thẩm: Án phí bao gồm án phí sơ thẩm và án phí phúc thẩm: Tiền tạm ứng lệ phí giải quyết việc dân sự bao gồm tiền tạm ứng lệ phí sơ thẩm và tiền tạm ứng lệ phí phúc thẩm: Lệ phí bao gồm lệ phí cấp bản sao bản án, quyết định và các giấy tờ khác của Tòa án, lệ phí nộp đơn yêu cầu Tòa án giải quyết việc dân sự, lệ phí giải quyết việc dân sự và các khoản lệ phí khác mà luật có quy định",Có quy định cụ thể nào liên quan đến việc điều chỉnh tiền tạm ứng án phí và tiền tạm ứng lệ phí án phí?
144,"Điều 471: Không thay đổi thẩm quyền giải quyết của Tòa án Vụ việc dân sự có yếu tố nước ngoài đã được một Tòa án Việt Nam thụ lý giải quyết theo quy định về thẩm quyền của Bộ luật này thì phải được Tòa án đó tiếp tục giải quyết mặc dù trong quá trình giải quyết có sự thay đổi quốc tịch, nơi cư trú, địa chỉ của các đương sự hoặc có tình tiết mới làm cho vụ việc dân sự đó thuộc thẩm quyền của Tòa án khác của Việt Nam hoặc của Tòa án nước ngoài","Trong trường hợp có nhiều đương sự và mỗi người có quốc tịch khác nhau, liệu có ảnh hưởng gì đến quy trình giải quyết vụ án và thẩm quyền của Tòa án?"
27,"Điều 129: Cấm tiếp xúc với nạn nhân bạo lực gia đình Cấm người có hành vi bạo lực gia đình tiếp xúc với nạn nhân bạo lực gia đình được áp dụng nếu biện pháp đó là cần thiết để bảo vệ tính mạng, sức khỏe, danh dự của nạn nhân bạo lực gia đình theo quy định của Luật phòng chống bạo lực gia đình",Có những biện pháp nào khác để bảo vệ nạn nhân bạo lực gia đình trong trường hợp cần thiết?
