,title,query
303,Điều 185: Áp dụng quy định của Bộ luật dân sự về thời hiệu Các quy định của Bộ luật dân sự về thời hiệu được áp dụng trong tố tụng dân sự,Quy định về thời hiệu trong tố tụng dân sự được áp dụng đối với tất cả các loại vụ án hay chỉ áp dụng cho một số trường hợp cụ thể?
178,"Điều 429: Bảo đảm quyền chuyển tiền, tài sản thi hành bản án, quyết định dân sự của Tòa án nước ngoài, phán quyết của Trọng tài nước ngoài Nhà nước Việt Nam bảo đảm việc chuyển tiền, tài sản thi hành bản án, quyết định dân sự của Tòa án nước ngoài, phán quyết của Trọng tài nước ngoài đã được Tòa án Việt Nam công nhận và cho thi hành từ Việt Nam ra nước ngoài: Việc chuyển tiền, tài sản này được thực hiện theo quy định của pháp luật Việt Nam","Nếu có thay đổi trong quyền lợi hay nghĩa vụ của bên liên quan sau khi quyết định được công nhận, liệu có quy định nào về việc thông báo và điều chỉnh không?"
427,"Điều 395: Quyết định hủy bỏ quyết định tuyên bố một người là đã chết Trường hợp chấp nhận đơn yêu cầu thì Tòa án ra quyết định hủy bỏ quyết định tuyên bố một người là đã chết trong quyết định này, Tòa án phải quyết định về hậu quả pháp lý của việc hủy bỏ quyết định tuyên bố một người là đã chết theo quy định của Bộ luật dân sự","Trong trường hợp Tòa án ra quyết định hủy bỏ quyết định tuyên bố một người là đã chết, người đó sẽ phải thực hiện những biện pháp nào để điều chỉnh tình trạng của họ?"
231,"Điều 476: Thông báo về việc thụ lý, ngày mở phiên họp, phiên tòa Tòa án phải gửi thông báo thụ lý vụ án, trong đó nêu rõ thời gian, địa điểm mở phiên họp kiểm tra việc giao nộp, tiếp cận, công khai chứng cứ và hòa giải (sau đây gọi chung là phiên họp hòa giải), mở lại phiên họp hòa giải, mở phiên tòa và mở lại phiên tòa trong văn bản thông báo thụ lý vụ án cho đương sự ở nước ngoài: Thời hạn mở phiên tòa, phiên họp hòa giải được xác định như sau Phiên họp hòa giải phải được mở sớm nhất là 06 tháng và chậm nhất là 08 tháng, kể từ ngày ra văn bản thông báo thụ lý vụ án: Ngày mở lại phiên họp hòa giải (nếu có) được ấn định cách ngày mở phiên họp hòa giải chậm nhất là 01 tháng Phiên tòa phải được mở sớm nhất là 09 tháng và chậm nhất là 12 tháng, kể từ ngày ra văn bản thông báo thụ lý vụ án: Ngày mở lại phiên tòa (nếu có) được ấn định cách ngày mở phiên tòa chậm nhất là 01 tháng, trừ trường hợp quy định tại khoản 4 Điều 477 của Bộ luật này: Tòa án phải gửi thông báo thụ lý việc dân sự, trong đó nêu rõ thời gian, địa điểm mở phiên họp, mở lại phiên họp giải quyết việc dân sự trong văn bản thông báo thụ lý việc dân sự cho đương sự ở nước ngoài: Phiên họp phải được mở sớm nhất là 06 tháng và chậm nhất là 08 tháng, kể từ ngày ra văn bản thông báo thụ lý việc dân sự: Ngày mở lại phiên họp giải quyết việc dân sự (nếu có) được ấn định cách ngày mở phiên họp lần đầu chậm nhất là 01 tháng",Thời hạn mở phiên họp hòa giải được xác định như thế nào theo quy định tại Điều 476?
337,"Điều 368: Quyết định việc thay đổi người tiến hành tố tụng khi giải quyết việc dân sự Trước khi mở phiên họp, việc thay đổi Thẩm phán, Thư ký phiên họp do Chánh án của Tòa án đang giải quyết việc dân sự đó quyết định nếu Thẩm phán bị thay đổi là Chánh án của Tòa án đang giải quyết việc dân sự đó thì việc thay đổi do Chánh án Tòa án trên một cấp trực tiếp quyết định: Tại phiên họp giải quyết việc dân sự, việc thay đổi Thẩm phán, Thư ký phiên họp được thực hiện như sau Trường hợp việc dân sự do một Thẩm phán giải quyết thì việc thay đổi Thẩm phán, Thư ký phiên họp do Chánh án của Tòa án đang giải quyết việc dân sự đó quyết định nếu Thẩm phán bị thay đổi là Chánh án của Tòa án đang giải quyết việc dân sự đó thì việc thay đổi do Chánh án Tòa án trên một cấp trực tiếp quyết định Trường hợp việc dân sự do Hội đồng giải quyết việc dân sự gồm ba Thẩm phán giải quyết thì việc thay đổi thành viên Hội đồng, Thư ký phiên họp do Hội đồng giải quyết việc dân sự quyết định: Trước khi mở phiên họp, việc thay đổi Kiểm sát viên do Viện trưởng Viện kiểm sát cùng cấp quyết định: Tại phiên họp, việc thay đổi Kiểm sát viên do Thẩm phán, Hội đồng giải quyết việc dân sự quyết định: Trường hợp phải thay đổi Kiểm sát viên thì Thẩm phán, Hội đồng giải quyết việc dân sự ra quyết định hoãn phiên họp và thông báo cho Viện kiểm sát: Việc cử Kiểm sát viên thay thế Kiểm sát viên bị thay đổi do Viện trưởng Viện kiểm sát cùng cấp quyết định: Nếu Kiểm sát viên bị thay đổi là Viện trưởng Viện kiểm sát thì do Viện trưởng Viện kiểm sát cấp trên trực tiếp quyết định","Thay đổi Thẩm phán, Thư ký phiên họp có thể xảy ra khi việc dân sự đang được giải quyết bởi Hội đồng giải quyết việc dân sự gồm ba Thẩm phán không?"
216,"Điều 290: Quyết định đưa vụ án ra xét xử phúc thẩm Quyết định đưa vụ án ra xét xử phúc thẩm phải có các nội dung chính sau đây Các nội dung quy định tại các điểm a, b, c, d, g, h và i khoản 1 Điều 220 của Bộ luật này Họ, tên Thẩm phán, Thư ký Tòa án họ, tên Thẩm phán dự khuyết (nếu có) Họ, tên, tư cách tham gia tố tụng của người kháng cáo Viện kiểm sát kháng nghị (nếu có) Họ, tên Kiểm sát viên tham gia phiên tòa họ, tên Kiểm sát viên dự khuyết (nếu có): Quyết định đưa vụ án ra xét xử phúc thẩm phải được gửi cho đương sự, Viện kiểm sát cùng cấp trong thời hạn 03 ngày làm việc, kể từ ngày ra quyết định",Việc gửi quyết định đưa vụ án ra xét xử phúc thẩm có yêu cầu thực hiện bằng phương tiện nào?
213,"Điều 290: Quyết định đưa vụ án ra xét xử phúc thẩm Quyết định đưa vụ án ra xét xử phúc thẩm phải có các nội dung chính sau đây Các nội dung quy định tại các điểm a, b, c, d, g, h và i khoản 1 Điều 220 của Bộ luật này Họ, tên Thẩm phán, Thư ký Tòa án họ, tên Thẩm phán dự khuyết (nếu có) Họ, tên, tư cách tham gia tố tụng của người kháng cáo Viện kiểm sát kháng nghị (nếu có) Họ, tên Kiểm sát viên tham gia phiên tòa họ, tên Kiểm sát viên dự khuyết (nếu có): Quyết định đưa vụ án ra xét xử phúc thẩm phải được gửi cho đương sự, Viện kiểm sát cùng cấp trong thời hạn 03 ngày làm việc, kể từ ngày ra quyết định",Quyết định đưa vụ án ra xét xử phúc thẩm cần phải được gửi cho ai và trong thời hạn bao lâu theo quy định tại Điều 290?
243,"Điều 39: Thẩm quyền của Tòa án theo lãnh thổ Thẩm quyền giải quyết vụ án dân sự của Tòa án theo lãnh thổ được xác định như sau Tòa án nơi bị đơn cư trú, làm việc, nếu bị đơn là cá nhân hoặc nơi bị đơn có trụ sở, nếu bị đơn là cơ quan, tổ chức có thẩm quyền giải quyết theo thủ tục sơ thẩm những tranh chấp về dân sự, hôn nhân và gia đình, kinh doanh, thương mại, lao động quy định tại các điều 26, 28, 30 và 32 của Bộ luật này Các đương sự có quyền tự thoả thuận với nhau bằng văn bản yêu cầu Tòa án nơi cư trú, làm việc của nguyên đơn, nếu nguyên đơn là cá nhân hoặc nơi có trụ sở của nguyên đơn, nếu nguyên đơn là cơ quan, tổ chức giải quyết những tranh chấp về dân sự, hôn nhân và gia đình, kinh doanh, thương mại, lao động quy định tại các điều 26, 28, 30 và 32 của Bộ luật này Đối tượng tranh chấp là bất động sản thì chỉ Tòa án nơi có bất động sản có thẩm quyền giải quyết: Thẩm quyền giải quyết việc dân sự của Tòa án theo lãnh thổ được xác định như sau Tòa án nơi người bị yêu cầu tuyên bố mất năng lực hành vi dân sự, bị hạn chế năng lực hành vi dân sự hoặc có khó khăn trong nhận thức, làm chủ hành vi cư trú, làm việc có thẩm quyền giải quyết yêu cầu tuyên bố một người mất năng lực hành vi dân sự, bị hạn chế năng lực hành vi dân sự hoặc có khó khăn trong nhận thức, làm chủ hành vi Tòa án nơi người bị yêu cầu thông báo tìm kiếm vắng mặt tại nơi cư trú, bị yêu cầu tuyên bố mất tích hoặc là đã chết có nơi cư trú cuối cùng có thẩm quyền giải quyết yêu cầu thông báo tìm kiếm người vắng mặt tại nơi cư trú và quản lý tài sản của người đó, yêu cầu tuyên bố một người mất tích hoặc là đã chết Tòa án nơi người yêu cầu hủy bỏ quyết định tuyên bố một người mất năng lực hành vi dân sự, bị hạn chế năng lực hành vi dân sự hoặc có khó khăn trong nhận thức, làm chủ hành vi cư trú, làm việc có thẩm quyền hủy bỏ quyết định tuyên bố một người mất năng lực hành vi dân sự, bị hạn chế năng lực hành vi dân sự hoặc có khó khăn trong nhận thức, làm chủ hành vi: Tòa án đã ra quyết định tuyên bố một người mất tích hoặc là đã chết có thẩm quyền giải quyết yêu cầu hủy bỏ quyết định tuyên bố một người mất tích hoặc là đã chết Tòa án nơi người phải thi hành bản án, quyết định dân sự, hôn nhân và gia đình, kinh doanh, thương mại, lao động của Tòa án nước ngoài cư trú, làm việc, nếu người phải thi hành án là cá nhân hoặc nơi người phải thi hành án có trụ sở, nếu người phải thi hành án là cơ quan, tổ chức hoặc nơi có tài sản liên quan đến việc thi hành bản án, quyết định của Tòa án nước ngoài có thẩm quyền giải quyết yêu cầu công nhận và cho thi hành tại Việt Nam hoặc không công nhận bản án, quyết định dân sự, hôn nhân và gia đình, kinh doanh, thương mại, lao động của Tòa án nước ngoài Tòa án nơi người gửi đơn cư trú, làm việc, nếu người gửi đơn là cá nhân hoặc nơi người gửi đơn có trụ sở, nếu người gửi đơn là cơ quan, tổ chức có thẩm quyền giải quyết yêu cầu không công nhận bản án, quyết định dân sự, hôn nhân và gia đình, kinh doanh, thương mại, lao động của Tòa án nước ngoài không có yêu cầu thi hành tại Việt Nam Tòa án nơi người phải thi hành phán quyết của Trọng tài nước ngoài cư trú, làm việc, nếu người phải thi hành là cá nhân hoặc nơi người phải thi hành có trụ sở, nếu người phải thi hành là cơ quan, tổ chức hoặc nơi có tài sản liên quan đến việc thi hành phán quyết của Trọng tài nước ngoài có thẩm quyền giải quyết yêu cầu công nhận và cho thi hành tại Việt Nam phán quyết của Trọng tài nước ngoài Tòa án nơi việc đăng ký kết hôn trái pháp luật được thực hiện có thẩm quyền giải quyết yêu cầu hủy việc kết hôn trái pháp luật Tòa án nơi một trong các bên thuận tình ly hôn, thỏa thuận nuôi con, chia tài sản khi ly hôn cư trú, làm việc có thẩm quyền giải quyết yêu cầu công nhận thuận tình ly hôn, thỏa thuận nuôi con, chia tài sản khi ly hôn Tòa án nơi một trong các bên thoả thuận về thay đổi người trực tiếp nuôi con sau khi ly hôn cư trú, làm việc có thẩm quyền giải quyết yêu cầu công nhận sự thoả thuận về thay đổi người trực tiếp nuôi con sau khi ly hôn: Trường hợp cơ quan, tổ chức, cá nhân yêu cầu thay đổi người trực tiếp nuôi con sau khi ly hôn thì Tòa án nơi người con đang cư trú có thẩm quyền giải quyết Tòa án nơi cha hoặc mẹ của con chưa thành niên cư trú, làm việc có thẩm quyền giải quyết yêu cầu hạn chế quyền của cha, mẹ đối với con chưa thành niên hoặc quyền thăm nom con sau khi ly hôn Tòa án nơi cha, mẹ nuôi hoặc con nuôi cư trú, làm việc có thẩm quyền giải quyết yêu cầu chấm dứt việc nuôi con nuôi Tòa án nơi tổ chức hành nghề công chứng đã thực hiện việc công chứng có trụ sở có thẩm quyền giải quyết yêu cầu tuyên bố văn bản công chứng vô hiệu Tòa án nơi cơ quan thi hành án có thẩm quyền thi hành án có trụ sở hoặc nơi có tài sản liên quan đến việc thi hành án có thẩm quyền giải quyết yêu cầu xác định quyền sở hữu, quyền sử dụng tài sản, phân chia tài sản chung để thi hành án và yêu cầu khác theo quy định của Luật thi hành án dân sự Thẩm quyền của Tòa án theo lãnh thổ giải quyết yêu cầu liên quan đến việc Trọng tài thương mại Việt Nam giải quyết tranh chấp được thực hiện theo quy định của pháp luật về Trọng tài thương mại Tòa án nơi có tài sản có thẩm quyền giải quyết yêu cầu công nhận tài sản đó có trên lãnh thổ Việt Nam là vô chủ, công nhận quyền sở hữu của người đang quản lý đối với tài sản vô chủ trên lãnh thổ Việt Nam Tòa án nơi người mang thai hộ cư trú, làm việc có thẩm quyền giải quyết yêu cầu liên quan đến việc mang thai hộ Tòa án nơi cư trú, làm việc của một trong những người có tài sản chung có thẩm quyền giải quyết yêu cầu công nhận thỏa thuận chấm dứt hiệu lực của việc chia tài sản chung trong thời kỳ hôn nhân đã được thực hiện theo bản án, quyết định của Tòa án Tòa án nơi người yêu cầu cư trú, làm việc có thẩm quyền giải quyết yêu cầu công nhận kết quả hòa giải thành ngoài Tòa án Tòa án nơi cư trú, làm việc của người yêu cầu có thẩm quyền giải quyết yêu cầu tuyên bố vô hiệu thỏa thuận về chế độ tài sản của vợ chồng theo quy định của pháp luật hôn nhân và gia đình xác định cha, mẹ cho con hoặc con cho cha, mẹ theo quy định của pháp luật về hôn nhân và gia đình Tòa án nơi có trụ sở của doanh nghiệp có thẩm quyền giải quyết yêu cầu hủy bỏ nghị quyết của Đại hội cổ đông, nghị quyết của Hội đồng thành viên Tòa án nơi giao kết hoặc thực hiện hợp đồng lao động, thỏa ước lao động tập thể có thẩm quyền giải quyết yêu cầu tuyên bố hợp đồng lao động, thỏa ước lao động tập thể đó vô hiệu Tòa án nơi xảy ra cuộc đình công có thẩm quyền giải quyết yêu cầu xét tính hợp pháp của cuộc đình công Thẩm quyền của Tòa án theo lãnh thổ giải quyết yêu cầu bắt giữ tàu bay, tàu biển được thực hiện theo quy định tại Điều 421 của Bộ luật này: Trường hợp vụ án dân sự đã được Tòa án thụ lý và đang giải quyết theo đúng quy định của Bộ luật này về thẩm quyền của Tòa án theo lãnh thổ thì phải được Tòa án đó tiếp tục giải quyết mặc dù trong quá trình giải quyết vụ án có sự thay đổi nơi cư trú, trụ sở hoặc địa chỉ giao dịch của đương sự",Thẩm quyền giải quyết việc một người mất tích hoặc đã chết được xác định như thế nào theo Điều 39?
421,"Điều 395: Quyết định hủy bỏ quyết định tuyên bố một người là đã chết Trường hợp chấp nhận đơn yêu cầu thì Tòa án ra quyết định hủy bỏ quyết định tuyên bố một người là đã chết trong quyết định này, Tòa án phải quyết định về hậu quả pháp lý của việc hủy bỏ quyết định tuyên bố một người là đã chết theo quy định của Bộ luật dân sự",Làm thế nào để chấp nhận đơn yêu cầu hủy bỏ quyết định tuyên bố một người là đã chết?
158,"Điều 383: Quyết định thông báo tìm kiếm người vắng mặt tại nơi cư trú: Trường hợp chấp nhận đơn yêu cầu thì Tòa án ra quyết định thông báo tìm kiếm người vắng mặt tại nơi cư trú trường hợp có yêu cầu Tòa án áp dụng biện pháp quản lý tài sản của người vắng mặt đó tại nơi cư trú và được chấp nhận thì trong quyết định, Tòa án còn phải quyết định áp dụng biện pháp quản lý tài sản của người đó theo quy định của Bộ luật dân sự","Nếu có tranh cãi về việc áp dụng biện pháp quản lý tài sản, liệu có quy trình giải quyết khiếu nại và xem xét quyết định của Tòa án không?"
293,"Điều 139: Hiệu lực của quyết định áp dụng, thay đổi, hủy bỏ biện pháp khẩn cấp tạm thời Quyết định áp dụng, thay đổi, hủy bỏ biện pháp khẩn cấp tạm thời có hiệu lực thi hành ngay: Tòa án phải cấp hoặc gửi quyết định áp dụng, thay đổi, hủy bỏ biện pháp khẩn cấp tạm thời ngay sau khi ra quyết định cho người có yêu cầu, người bị áp dụng biện pháp khẩn cấp tạm thời, cơ quan, tổ chức, cá nhân có liên quan, cơ quan thi hành án dân sự có thẩm quyền và Viện kiểm sát cùng cấp","Theo Điều 139, biện pháp khẩn cấp tạm thời có thể thay đổi hoặc hủy bỏ. Tình huống nào có thể dẫn đến việc thay đổi hoặc hủy bỏ biện pháp này?"
316,"Điều 127: Cấm hoặc buộc thực hiện hành vi nhất định Cấm hoặc buộc thực hiện hành vi nhất định được áp dụng nếu trong quá trình giải quyết vụ án có căn cứ cho thấy đương sự hoặc cơ quan, tổ chức, cá nhân khác thực hiện hoặc không thực hiện một hoặc một số hành vi nhất định làm ảnh hưởng đến việc giải quyết vụ án, quyền và lợi ích hợp pháp của người khác có liên quan trong vụ án đang được Tòa án giải quyết",Quyền tự quyết của đương sự trong vụ án có được bảo vệ trong bối cảnh của Điều 127? Làm thế nào để đảm bảo sự cân đối giữa quyền này và việc ngăn chặn hành vi nhất định?
370,"Điều 44: Trình tự, thủ tục thụ lý, giải quyết vụ việc dân sự trong trường hợp chưa có điều luật để áp dụng Trình tự, thủ tục thụ lý, giải quyết vụ việc dân sự trong trường hợp chưa có điều luật để áp dụng được thực hiện theo quy định của Bộ luật này","Khi chưa có điều luật cụ thể áp dụng, thì quy định nào của Bộ luật điều chỉnh trình tự và thủ tục thụ lý vụ việc dân sự?"
104,"Điều 132: Các biện pháp khẩn cấp tạm thời khác Ngoài các biện pháp khẩn cấp tạm thời quy định tại các khoản từ khoản 1 đến khoản 16 Điều 114 của Bộ luật này, Tòa án có trách nhiệm giải quyết yêu cầu áp dụng biện pháp khẩn tạm thời khác do luật khác quy định",Tòa án có trách nhiệm đánh giá và xác minh thông tin đằng sau yêu cầu áp dụng biện pháp khẩn cấp tạm thời khác không?
450,"Điều 143: Tiền tạm ứng án phí, tiền tạm ứng lệ phí án phí, lệ phí Tiền tạm ứng án phí bao gồm tiền tạm ứng án phí sơ thẩm và tiền tạm ứng án phí phúc thẩm: Án phí bao gồm án phí sơ thẩm và án phí phúc thẩm: Tiền tạm ứng lệ phí giải quyết việc dân sự bao gồm tiền tạm ứng lệ phí sơ thẩm và tiền tạm ứng lệ phí phúc thẩm: Lệ phí bao gồm lệ phí cấp bản sao bản án, quyết định và các giấy tờ khác của Tòa án, lệ phí nộp đơn yêu cầu Tòa án giải quyết việc dân sự, lệ phí giải quyết việc dân sự và các khoản lệ phí khác mà luật có quy định",Tiền tạm ứng án phí và tiền tạm ứng lệ phí án phí có điểm gì đặc biệt?
127,"Điều 490: Xử lý hành vi cố ý không có mặt theo giấy triệu tập của Tòa án Người làm chứng, người phiên dịch, người giám định đã được Tòa án triệu tập hợp lệ nhưng cố ý không đến Tòa án hoặc không có mặt tại phiên tòa, phiên họp mà không có lý do chính đáng và nếu sự vắng mặt của họ gây trở ngại cho việc thu thập, xác minh chứng cứ hoặc giải quyết vụ việc thì bị xử phạt hành chính theo quy định của pháp luật: Trong trường hợp quy định tại khoản 1 Điều này, Tòa án có quyền ra quyết định dẫn giải người làm chứng đến phiên tòa, phiên họp, trừ trường hợp người làm chứng là người chưa thành niên: Quyết định dẫn giải người làm chứng phải ghi rõ thời gian, địa điểm ra quyết định họ, tên, chức vụ người ra quyết định họ, tên, ngày, tháng, năm sinh, nơi cư trú của người làm chứng thời gian, địa điểm người làm chứng phải có mặt: Cơ quan công an có nhiệm vụ thi hành quyết định của Tòa án dẫn giải người làm chứng: Người thi hành quyết định dẫn giải người làm chứng phải đọc, giải thích quyết định dẫn giải cho người bị dẫn giải biết và lập biên bản về việc dẫn giải","Nếu người làm chứng đã bị dẫn giải nhưng vẫn không đến phiên tòa, liệu xử phạt hành chính sẽ áp dụng ngay lập tức hay sau khi kiểm tra các tình tiết xung quanh?"
65,"Điều 493: Xử lý hành vi cản trở việc cấp, giao, nhận, tống đạt, thông báo văn bản tố tụng của Tòa án Người có một trong các hành vi sau đây thì tuỳ theo tính chất, mức độ vi phạm mà bị xử lý kỷ luật, xử phạt hành chính hoặc bị truy cứu trách nhiệm hình sự theo quy định của pháp luật Không thực hiện việc cấp, giao, tống đạt, thông báo văn bản tố tụng của Tòa án theo yêu cầu của Tòa án mà không có lý do chính đáng Hủy hoại văn bản tố tụng của Tòa án mà mình được giao để cấp, tống đạt, thông báo theo yêu cầu của Tòa án Giả mạo kết quả thực hiện việc tống đạt, thông báo văn bản tố tụng của Tòa án mà mình được giao thực hiện Ngăn cản việc cấp, giao, nhận, tống đạt, thông báo văn bản tố tụng của Tòa án",Những trường hợp cụ thể mà việc hủy hoại văn bản tố tụng của Tòa án được coi là vi phạm theo điều 493?
