,title,query
162,"Điều 246: Công nhận sự thoả thuận của các đương sự Chủ tọa phiên tòa hỏi các đương sự có thoả thuận được với nhau về việc giải quyết vụ án hay không trường hợp các đương sự thoả thuận được với nhau về việc giải quyết vụ án và thoả thuận của họ là tự nguyện, không vi phạm điều cấm của luật và không trái đạo đức xã hội thì Hội đồng xét xử ra quyết định công nhận sự thoả thuận của các đương sự về việc giải quyết vụ án: Quyết định công nhận sự thoả thuận của các đương sự về việc giải quyết vụ án có hiệu lực pháp luật theo quy định tại Điều 213 của Bộ luật này","Trong trường hợp các đương sự không thoả thuận được với nhau, liệu có quy định cụ thể về cách giải quyết vụ án từ phía Hội đồng xét xử?"
168,"Điều 246: Công nhận sự thoả thuận của các đương sự Chủ tọa phiên tòa hỏi các đương sự có thoả thuận được với nhau về việc giải quyết vụ án hay không trường hợp các đương sự thoả thuận được với nhau về việc giải quyết vụ án và thoả thuận của họ là tự nguyện, không vi phạm điều cấm của luật và không trái đạo đức xã hội thì Hội đồng xét xử ra quyết định công nhận sự thoả thuận của các đương sự về việc giải quyết vụ án: Quyết định công nhận sự thoả thuận của các đương sự về việc giải quyết vụ án có hiệu lực pháp luật theo quy định tại Điều 213 của Bộ luật này","Trong trường hợp thoả thuận liên quan đến các vấn đề nhạy cảm như quyền lợi của trẻ em, liệu có cơ chế đặc biệt nào được áp dụng không?"
67,"Điều 493: Xử lý hành vi cản trở việc cấp, giao, nhận, tống đạt, thông báo văn bản tố tụng của Tòa án Người có một trong các hành vi sau đây thì tuỳ theo tính chất, mức độ vi phạm mà bị xử lý kỷ luật, xử phạt hành chính hoặc bị truy cứu trách nhiệm hình sự theo quy định của pháp luật Không thực hiện việc cấp, giao, tống đạt, thông báo văn bản tố tụng của Tòa án theo yêu cầu của Tòa án mà không có lý do chính đáng Hủy hoại văn bản tố tụng của Tòa án mà mình được giao để cấp, tống đạt, thông báo theo yêu cầu của Tòa án Giả mạo kết quả thực hiện việc tống đạt, thông báo văn bản tố tụng của Tòa án mà mình được giao thực hiện Ngăn cản việc cấp, giao, nhận, tống đạt, thông báo văn bản tố tụng của Tòa án","Trách nhiệm của các bên liên quan đối với việc ngăn cản việc cấp, giao, nhận, tống đạt, thông báo văn bản tố tụng của Tòa án như thế nào?"
33,"Điều 411: Trình tự phiên họp xét tính hợp pháp của cuộc đình công Thẩm phán chủ trì phiên họp xét tính hợp pháp của cuộc đình công công bố quyết định mở phiên họp xét tính hợp pháp của cuộc đình công và tóm tắt nội dung đơn yêu cầu: Đại diện tổ chức đại diện tập thể lao động và đại diện của người sử dụng lao động trình bày ý kiến của mình: Thẩm phán chủ trì phiên họp xét tính hợp pháp của cuộc đình công có thể yêu cầu đại diện cơ quan, tổ chức tham gia phiên họp trình bày ý kiến: Kiểm sát viên phát biểu ý kiến của Viện kiểm sát về việc xét tính hợp pháp của cuộc đình công: Ngay sau khi kết thúc phiên họp, Kiểm sát viên phải gửi văn bản phát biểu ý kiến cho Tòa án để lưu vào hồ sơ việc dân sự: Hội đồng xét tính hợp pháp của cuộc đình công thảo luận và quyết định theo đa số","Ngày kết thúc phiên họp, Kiểm sát viên cần gửi văn bản phát biểu ý kiến cho ai và vì mục đích gì?"
16,"Điều 45: Nguyên tắc giải quyết vụ việc dân sự trong trường hợp chưa có điều luật để áp dụng Việc áp dụng tập quán được thực hiện như sau Tòa án áp dụng tập quán để giải quyết vụ việc dân sự trong trường hợp các bên không có thỏa thuận và pháp luật không quy định: Tập quán không được trái với các nguyên tắc cơ bản của pháp luật dân sự quy định tại Điều 3 của Bộ luật dân sự: Khi yêu cầu Tòa án giải quyết vụ việc dân sự, đương sự có quyền viện dẫn tập quán để yêu cầu Tòa án xem xét áp dụng: Tòa án có trách nhiệm xác định giá trị áp dụng của tập quán bảo đảm đúng quy định tại Điều 5 của Bộ luật dân sự: Trường hợp các đương sự viện dẫn các tập quán khác nhau thì tập quán có giá trị áp dụng là tập quán được thừa nhận tại nơi phát sinh vụ việc dân sự: Việc áp dụng tương tự pháp luật được thực hiện như sau Tòa án áp dụng tương tự pháp luật để giải quyết vụ việc dân sự trong trường hợp các bên không có thỏa thuận, pháp luật không có quy định và không có tập quán được áp dụng theo quy định tại Điều 5 của Bộ luật dân sự và khoản 1 Điều này: Khi áp dụng tương tự pháp luật, Tòa án phải xác định rõ tính chất pháp lý của vụ việc dân sự, xác định rõ ràng trong hệ thống pháp luật hiện hành không có quy phạm pháp luật nào điều chỉnh quan hệ đó và xác định quy phạm pháp luật điều chỉnh quan hệ dân sự tương tự: Việc áp dụng các nguyên tắc cơ bản của pháp luật dân sự, án lệ, lẽ công bằng được thực hiện như sau Tòa án áp dụng các nguyên tắc cơ bản của pháp luật dân sự, án lệ, lẽ công bằng để giải quyết vụ việc dân sự khi không thể áp dụng tập quán, tương tự pháp luật theo quy định tại Điều 5 và khoản 1 Điều 6 của Bộ luật dân sự, khoản 1 và khoản 2 Điều này: Các nguyên tắc cơ bản của pháp luật dân sự là những nguyên tắc được quy định tại Điều 3 của Bộ luật dân sự: Án lệ được Tòa án nghiên cứu, áp dụng trong giải quyết vụ việc dân sự khi đã được Hội đồng Thẩm phán Tòa án nhân dân tối cao lựa chọn và được Chánh án Tòa án nhân dân tối cao công bố: Lẽ công bằng được xác định trên cơ sở lẽ phải được mọi người trong xã hội thừa nhận, phù hợp với nguyên tắc nhân đạo, không thiên vị và bình đẳng về quyền và nghĩa vụ của các đương sự trong vụ việc dân sự đó",Lẽ công bằng được xác định như thế nào khi Tòa án giải quyết vụ việc dân sự?
39,"Điều 411: Trình tự phiên họp xét tính hợp pháp của cuộc đình công Thẩm phán chủ trì phiên họp xét tính hợp pháp của cuộc đình công công bố quyết định mở phiên họp xét tính hợp pháp của cuộc đình công và tóm tắt nội dung đơn yêu cầu: Đại diện tổ chức đại diện tập thể lao động và đại diện của người sử dụng lao động trình bày ý kiến của mình: Thẩm phán chủ trì phiên họp xét tính hợp pháp của cuộc đình công có thể yêu cầu đại diện cơ quan, tổ chức tham gia phiên họp trình bày ý kiến: Kiểm sát viên phát biểu ý kiến của Viện kiểm sát về việc xét tính hợp pháp của cuộc đình công: Ngay sau khi kết thúc phiên họp, Kiểm sát viên phải gửi văn bản phát biểu ý kiến cho Tòa án để lưu vào hồ sơ việc dân sự: Hội đồng xét tính hợp pháp của cuộc đình công thảo luận và quyết định theo đa số",Người sử dụng lao động có thể đề nghị gì trong phiên họp xét tính hợp pháp của cuộc đình công theo quy định của Điều 411?
335,"Điều 368: Quyết định việc thay đổi người tiến hành tố tụng khi giải quyết việc dân sự Trước khi mở phiên họp, việc thay đổi Thẩm phán, Thư ký phiên họp do Chánh án của Tòa án đang giải quyết việc dân sự đó quyết định nếu Thẩm phán bị thay đổi là Chánh án của Tòa án đang giải quyết việc dân sự đó thì việc thay đổi do Chánh án Tòa án trên một cấp trực tiếp quyết định: Tại phiên họp giải quyết việc dân sự, việc thay đổi Thẩm phán, Thư ký phiên họp được thực hiện như sau Trường hợp việc dân sự do một Thẩm phán giải quyết thì việc thay đổi Thẩm phán, Thư ký phiên họp do Chánh án của Tòa án đang giải quyết việc dân sự đó quyết định nếu Thẩm phán bị thay đổi là Chánh án của Tòa án đang giải quyết việc dân sự đó thì việc thay đổi do Chánh án Tòa án trên một cấp trực tiếp quyết định Trường hợp việc dân sự do Hội đồng giải quyết việc dân sự gồm ba Thẩm phán giải quyết thì việc thay đổi thành viên Hội đồng, Thư ký phiên họp do Hội đồng giải quyết việc dân sự quyết định: Trước khi mở phiên họp, việc thay đổi Kiểm sát viên do Viện trưởng Viện kiểm sát cùng cấp quyết định: Tại phiên họp, việc thay đổi Kiểm sát viên do Thẩm phán, Hội đồng giải quyết việc dân sự quyết định: Trường hợp phải thay đổi Kiểm sát viên thì Thẩm phán, Hội đồng giải quyết việc dân sự ra quyết định hoãn phiên họp và thông báo cho Viện kiểm sát: Việc cử Kiểm sát viên thay thế Kiểm sát viên bị thay đổi do Viện trưởng Viện kiểm sát cùng cấp quyết định: Nếu Kiểm sát viên bị thay đổi là Viện trưởng Viện kiểm sát thì do Viện trưởng Viện kiểm sát cấp trên trực tiếp quyết định","Làm thế nào để đảm bảo tính công bằng và đáng tin cậy trong việc thay đổi Thẩm phán, Thư ký phiên họp khi giải quyết việc dân sự?"
466,"Điều 101: Xem xét, thẩm định tại chỗ Theo yêu cầu của đương sự hoặc khi xét thấy cần thiết, Thẩm phán tiến hành việc xem xét, thẩm định tại chỗ với sự có mặt của đại diện Ủy ban nhân dân cấp xã hoặc Công an xã, phường, thị trấn hoặc cơ quan, tổ chức nơi có đối tượng cần xem xét, thẩm định và phải báo trước việc xem xét, thẩm định tại chỗ để đương sự biết và chứng kiến việc xem xét, thẩm định đó: Việc xem xét, thẩm định tại chỗ phải được ghi thành biên bản: Biên bản phải ghi rõ kết quả xem xét, thẩm định, mô tả rõ hiện trường, có chữ ký của người xem xét, thẩm định và chữ ký hoặc điểm chỉ của đương sự nếu họ có mặt, của đại diện Ủy ban nhân dân cấp xã hoặc Công an xã, phường, thị trấn hoặc cơ quan, tổ chức nơi có đối tượng được xem xét, thẩm định và những người khác được mời tham gia việc xem xét, thẩm định: Sau khi lập xong biên bản, người xem xét, thẩm định phải yêu cầu đại diện Ủy ban nhân dân cấp xã hoặc Công an xã, phường, thị trấn hoặc cơ quan, tổ chức nơi có đối tượng được xem xét, thẩm định ký tên và đóng dấu xác nhận: Nghiêm cấm mọi hành vi cản trở việc xem xét, thẩm định tại chỗ: Thẩm phán có quyền đề nghị Ủy ban nhân dân cấp xã, Công an xã, phường, thị trấn nơi có đối tượng được xem xét, thẩm định tại chỗ hỗ trợ trong trường hợp có hành vi cản trở việc xem xét, thẩm định tại chỗ","Thẩm phán phải thực hiện những biện pháp gì để đảm bảo an toàn và trật tự trong quá trình xem xét, thẩm định tại chỗ?"
204,"Điều 268: Sửa chữa, bổ sung bản án Sau khi tuyên án xong thì không được sửa chữa, bổ sung bản án, trừ trường hợp phát hiện lỗi rõ ràng về chính tả, về số liệu do nhầm lẫn hoặc tính toán sai: Trường hợp cần sửa chữa, bổ sung bản án theo quy định tại khoản 1 Điều này thì Thẩm phán phối hợp với các Hội thẩm nhân dân là thành viên Hội đồng xét xử đã tuyên bản án đó phải ra quyết định sửa chữa, bổ sung bản án và gửi ngay cho đương sự, cơ quan, tổ chức, cá nhân khởi kiện, Viện kiểm sát cùng cấp và cơ quan thi hành án dân sự nếu bản án đã được gửi cho cơ quan thi hành án dân sự: Trường hợp Thẩm phán đã xét xử vụ án đó không còn đảm nhiệm chức vụ Thẩm phán tại Tòa án đã ra bản án đó thì Chánh án Tòa án thực hiện việc sửa chữa, bổ sung bản án","Trong trường hợp Thẩm phán ban đầu không còn đảm nhiệm chức vụ tại Tòa án đã ra bản án, ai thực hiện việc sửa chữa, bổ sung bản án theo Điều 268?"
90,"Điều 107: Bảo quản tài liệu, chứng cứ Tài liệu, chứng cứ đã được giao nộp tại Tòa án thì việc bảo quản tài liệu, chứng cứ đó do Tòa án chịu trách nhiệm: Tài liệu, chứng cứ không thể giao nộp được tại Tòa án thì người đang lưu giữ tài liệu, chứng cứ đó có trách nhiệm bảo quản: Trường hợp cần giao tài liệu, chứng cứ cho người thứ ba bảo quản thì Thẩm phán ra quyết định và lập biên bản giao cho người đó bảo quản: Người nhận bảo quản phải ký tên vào biên bản, được hưởng thù lao và phải chịu trách nhiệm về việc bảo quản tài liệu, chứng cứ theo quy định của pháp luật: Nghiêm cấm việc hủy hoại tài liệu, chứng cứ",Làm thế nào để xác định liệu một tài liệu hoặc chứng cứ có thể giao nộp tại Tòa án theo Điều 107?
119,"Điều 462: Xét kháng cáo, kháng nghị Tòa án nhân dân cấp cao xét lại quyết định của Tòa án nhân dân cấp tỉnh bị kháng cáo, kháng nghị trong thời hạn 01 tháng, kể từ ngày nhận được hồ sơ trường hợp cần phải yêu cầu giải thích theo quy định tại khoản 1 Điều 457 của Bộ luật này thì thời hạn này được kéo dài, nhưng không quá 02 tháng: Thành phần Hội đồng xét quyết định bị kháng cáo, kháng nghị gồm ba Thẩm phán, trong đó có một Thẩm phán làm chủ tọa theo sự phân công của Chánh án Tòa án nhân dân cấp cao: Phiên họp xét lại quyết định bị kháng cáo, kháng nghị được tiến hành như phiên họp xét đơn yêu cầu quy định tại Điều 458 của Bộ luật này: Hội đồng xét quyết định bị kháng cáo, kháng nghị có các quyền sau đây Giữ nguyên quyết định của Tòa án cấp sơ thẩm Sửa một phần hoặc toàn bộ quyết định của Tòa án cấp sơ thẩm Tạm đình chỉ giải quyết kháng cáo, kháng nghị Đình chỉ giải quyết kháng cáo, kháng nghị Hủy quyết định của Tòa án cấp sơ thẩm và chuyển hồ sơ cho Tòa án cấp sơ thẩm để giải quyết lại theo thủ tục sơ thẩm Hủy quyết định sơ thẩm và đình chỉ giải quyết đơn yêu cầu khi có một trong các căn cứ quy định tại khoản 3 Điều 457 của Bộ luật này: Hội đồng xét quyết định bị kháng cáo, kháng nghị đình chỉ giải quyết kháng cáo, kháng nghị trong các trường hợp sau đây Đương sự kháng cáo rút toàn bộ kháng cáo hoặc Viện kiểm sát rút toàn bộ kháng nghị Đương sự kháng cáo đã được triệu tập hợp lệ lần thứ hai mà vẫn vắng mặt và không có đơn yêu cầu giải quyết vắng mặt: Trường hợp đương sự kháng cáo rút toàn bộ kháng cáo hoặc Viện kiểm sát rút toàn bộ kháng nghị trước khi Tòa án cấp phúc thẩm ra quyết định mở phiên họp xét kháng cáo, kháng nghị thì Thẩm phán được phân công làm chủ tọa phiên họp ra quyết định đình chỉ giải quyết kháng cáo, kháng nghị: Trường hợp đương sự kháng cáo rút toàn bộ kháng cáo, Viện kiểm sát rút toàn bộ kháng nghị sau khi Tòa án cấp phúc thẩm ra quyết định mở phiên họp xét kháng cáo, kháng nghị thì Hội đồng xét kháng cáo, kháng nghị ra quyết định đình chỉ giải quyết xét kháng cáo, kháng nghị: Trong các trường hợp này, quyết định của Tòa án cấp sơ thẩm có hiệu lực pháp luật từ ngày Tòa án cấp phúc thẩm ra quyết định đình chỉ xét kháng cáo, kháng nghị: Hội đồng xét quyết định bị kháng cáo, kháng nghị hủy quyết định của Tòa án cấp sơ thẩm và chuyển hồ sơ cho Tòa án cấp sơ thẩm để giải quyết lại theo thủ tục sơ thẩm trong các trường hợp sau đây Việc chứng minh của đương sự phản đối việc công nhận phán quyết của Trọng tài nước ngoài hoặc căn cứ để Tòa án cấp sơ thẩm ra quyết định công nhận hoặc không công nhận phán quyết của Trọng tài nước ngoài không đúng quy định tại Chương XXXV và Chương XXXVII của Bộ luật này, các quy định khác có liên quan của pháp luật Việt Nam và điều ước quốc tế mà Cộng hòa xã hội chủ nghĩa Việt Nam là thành viên Thành phần của Hội đồng xét đơn của Tòa án cấp sơ thẩm không đúng quy định tại Chương XXXVII của Bộ luật này hoặc có vi phạm nghiêm trọng khác về thủ tục tố tụng ảnh hưởng đến quyền và lợi ích hợp pháp của đương sự: Quyết định của Tòa án nhân dân cấp cao có hiệu lực pháp luật kể từ ngày ra quyết định và có thể bị kháng nghị theo thủ tục giám đốc thẩm, tái thẩm theo quy định của Bộ luật này","Nếu có vi phạm nghiêm trọng về thủ tục tố tụng ảnh hưởng đến quyền và lợi ích hợp pháp của đương sự, liệu Hội đồng xét đơn của Tòa án cấp sơ thẩm có thể bị truy cứu trách nhiệm và quy trình xử lý vi phạm này sẽ như thế nào theo quy định của Bộ luật?"
108,"Điều 132: Các biện pháp khẩn cấp tạm thời khác Ngoài các biện pháp khẩn cấp tạm thời quy định tại các khoản từ khoản 1 đến khoản 16 Điều 114 của Bộ luật này, Tòa án có trách nhiệm giải quyết yêu cầu áp dụng biện pháp khẩn tạm thời khác do luật khác quy định",Người đề xuất yêu cầu áp dụng biện pháp khẩn cấp tạm thời khác có trách nhiệm cung cấp bằng chứng hay lý do để chứng minh cấp thiết của yêu cầu đó không?
84,"Điều 405: Thẩm quyền xét tính hợp pháp của cuộc đình công Tòa án nhân dân cấp tỉnh nơi xảy ra đình công có thẩm quyền xét tính hợp pháp của cuộc đình công: Tòa án nhân dân cấp cao có thẩm quyền giải quyết kháng cáo, kháng nghị đối với quyết định của Tòa án nhân dân cấp tỉnh về tính hợp pháp của cuộc đình công trong phạm vi thẩm quyền theo lãnh thổ",Có các trường hợp ngoại lệ nào mà Tòa án nhân dân cấp cao có thể giải quyết liên quan đến cuộc đình công không nằm trong lãnh thổ của họ theo Điều 405 không?
277,"Điều 197: Phân công Thẩm phán giải quyết vụ án Trên cơ sở báo cáo thụ lý vụ án của Thẩm phán được phân công thụ lý vụ án, Chánh án Tòa án quyết định phân công Thẩm phán giải quyết vụ án bảo đảm nguyên tắc vô tư, khách quan, ngẫu nhiên: Trong thời hạn 03 ngày làm việc, kể từ ngày thụ lý vụ án, Chánh án Tòa án quyết định phân công Thẩm phán giải quyết vụ án: Đối với vụ án phức tạp, việc giải quyết có thể phải kéo dài thì Chánh án Tòa án phân công Thẩm phán dự khuyết để bảo đảm xét xử đúng thời hạn theo quy định của Bộ luật này: Trong quá trình giải quyết vụ án, nếu Thẩm phán được phân công không thể tiếp tục tiến hành được nhiệm vụ thì Chánh án Tòa án phân công Thẩm phán khác tiếp tục nhiệm vụ trường hợp đang xét xử mà không có Thẩm phán dự khuyết thì vụ án phải được xét xử lại từ đầu và Tòa án phải thông báo cho đương sự, Viện kiểm sát cùng cấp",Điều 197 nêu rõ mục tiêu chính của việc phân công Thẩm phán trong quá trình giải quyết vụ án là gì?
401,"Điều 224: Hình thức bố trí phòng xử án Quốc huy nước Cộng hòa xã hội chủ nghĩa Việt Nam được treo chính giữa phía trên phòng xử án và phía trên chỗ ngồi của Hội đồng xét xử: Phòng xử án phải có các khu vực được bố trí riêng cho Hội đồng xét xử, Kiểm sát viên, Thư ký Tòa án, đương sự, người bảo vệ quyền và lợi ích hợp pháp của đương sự, những người tham gia tố tụng khác và người tham dự phiên tòa",Quy định chi tiết về việc treo Quốc huy nước Cộng hòa xã hội chủ nghĩa Việt Nam trong phòng xử án nằm ở đâu?
217,"Điều 290: Quyết định đưa vụ án ra xét xử phúc thẩm Quyết định đưa vụ án ra xét xử phúc thẩm phải có các nội dung chính sau đây Các nội dung quy định tại các điểm a, b, c, d, g, h và i khoản 1 Điều 220 của Bộ luật này Họ, tên Thẩm phán, Thư ký Tòa án họ, tên Thẩm phán dự khuyết (nếu có) Họ, tên, tư cách tham gia tố tụng của người kháng cáo Viện kiểm sát kháng nghị (nếu có) Họ, tên Kiểm sát viên tham gia phiên tòa họ, tên Kiểm sát viên dự khuyết (nếu có): Quyết định đưa vụ án ra xét xử phúc thẩm phải được gửi cho đương sự, Viện kiểm sát cùng cấp trong thời hạn 03 ngày làm việc, kể từ ngày ra quyết định",Có những điều kiện cụ thể nào cần thỏa mãn để quyết định đưa vụ án ra xét xử phúc thẩm theo Điều 290?
453,"Điều 143: Tiền tạm ứng án phí, tiền tạm ứng lệ phí án phí, lệ phí Tiền tạm ứng án phí bao gồm tiền tạm ứng án phí sơ thẩm và tiền tạm ứng án phí phúc thẩm: Án phí bao gồm án phí sơ thẩm và án phí phúc thẩm: Tiền tạm ứng lệ phí giải quyết việc dân sự bao gồm tiền tạm ứng lệ phí sơ thẩm và tiền tạm ứng lệ phí phúc thẩm: Lệ phí bao gồm lệ phí cấp bản sao bản án, quyết định và các giấy tờ khác của Tòa án, lệ phí nộp đơn yêu cầu Tòa án giải quyết việc dân sự, lệ phí giải quyết việc dân sự và các khoản lệ phí khác mà luật có quy định",Lệ phí trong việc giải quyết việc dân sự bao gồm những khoản phí nào và có mục tiêu gì?
376,"Điều 44: Trình tự, thủ tục thụ lý, giải quyết vụ việc dân sự trong trường hợp chưa có điều luật để áp dụng Trình tự, thủ tục thụ lý, giải quyết vụ việc dân sự trong trường hợp chưa có điều luật để áp dụng được thực hiện theo quy định của Bộ luật này",Liệu việc áp dụng Điều 44 của Bộ luật dân sự có thể tạo ra sự linh hoạt trong việc giải quyết vụ việc dân sự không?
